<?xml version="1.0" encoding="UTF-8"?>
<!DOCTYPE personas SYSTEM "ejercicio03.dtd">

<personas>
	<persona id="1">
		<nombre>Pablo</nombre>
		<nacimiento dia="11" mes="10" anio="1999"/>
		<genero sexo="hombre"/>
		<direccion>
			<provincia>huelva</provincia>
			<poblacion>Valverde</poblacion>
			<cpostal>11111</cpostal>
			<calle>jardines</calle>
		</direccion>
	</persona>
	<persona id="2">
		<nombre>Sara</nombre>
		<nacimiento dia="10" mes="05" anio="1980"/>
		<genero sexo="mujer"/>
		<direccion>
			<provincia>Granada</provincia>
			<poblacion>Motril</poblacion>
			<cpostal>22221</cpostal>
			<calle>rosales</calle>
		</direccion>
	</persona>
</personas>